{
  "schema_version": "v1",
  "id": "artifact-meal-planner-001",
  "type": "source_code",
  "location": "meal-planner/frontend/src/routes/shopping-list/index.tsx",
  "content": null,
  "metadata": {
    "trace_id": "trace-meal-planner-001",
    "target_repo": "meal-planner",
    "repo_profile_id": "repo-profile-meal-planner",
    "purpose": "shopping-list-empty-state-improvement"
  }
}
